<?xml version="1.0" encoding="UTF-8"?>

<!ELEMENT recipe (recipeType,list,action+)>
<!ELEMENT recipeType (#PCDATA)>
<!ELEMENT list (ingredient+)>
<!ELEMENT ingredient (#PCDATA)>
<!ELEMENT action (#PCDATA)>
