<?xml version="1.0" encoding="UTF-8"?>
<?xml-stylesheet type="text/css" href="recipe.css"?>
<!DOCTYPE recipe SYSTEM "recipe.dtd">

<recipe>
  <recipeType> Cream Cheese Frosting </recipeType> 
    <list> 
      <ingredient> 8 oz cream cheese, softened </ingredient>
      <ingredient> 1 stick unsalted butter, softened </ingredient>
      <ingredient> 1 tsp vanilla extract </ingredient>
      <ingredient> 3 cups confectioners’ sugar </ingredient>
  </list>
      <action> Beat together cream cheese, butter, and vanilla until slightly fluffy </action>
      <action> Slowly add confectioners’ sugar, beating until smooth to your liking. </action>
      <action> Frost your cake, cupcake, or muffin. </action>
</recipe>
